{
  "confirmed": true,
  "market": "Fictional sample market",
  "currency": "USD",
  "requirements": [
    "Daytime schedule"
  ],
  "preferences": [
    "Hybrid work",
    "Structured training"
  ],
  "learning_interests": [
    "Project coordination"
  ],
  "timeline": "Exploratory",
  "optional_minimum_base": null,
  "unknowns": []
}
